{
  "family": "parser",
  "version": "1.0.0",
  "description": "Golden parser fixtures (T04-03/T04-04, ADR-0002): multi-language source -> expected units {unit_kind, byte span, local_name, kind, anchor, parent} and classified unresolved references. Each case declares its `language` (TypeScript in T04-03, JavaScript in T04-04, Rust in T04-05, Python in T24-01 per ADR-0015). Implementation-specific sig hashes / full serialized locators are pinned in crate-local goldens, not here (neutrality for cross-language reuse).",
  "cases": [
    {
      "id": "parser.ts.declarations",
      "title": "Core declaration kinds each become a symbol unit",
      "status": "active",
      "provenance": {
        "source": "T04-03 (authored); TypeScript adapter over tree-sitter tsx"
      },
      "language": "typescript",
      "category": "syntax",
      "source": "export function foo(a: number): void {}\nclass Bar {}\ninterface I {}\nenum E { A }\ntype T = number;\nnamespace N {}\nexport const g = (x: number) => x;\n",
      "expected_units": [
        {
          "unit_kind": "file",
          "span_start": 0,
          "span_end": 148,
          "local_name": null,
          "kind": null,
          "anchor": "p:file",
          "parent": null
        },
        {
          "unit_kind": "symbol",
          "span_start": 7,
          "span_end": 39,
          "local_name": "foo",
          "kind": "function",
          "anchor": "p:function:foo",
          "parent": null
        },
        {
          "unit_kind": "symbol",
          "span_start": 40,
          "span_end": 52,
          "local_name": "Bar",
          "kind": "class",
          "anchor": "p:class:Bar",
          "parent": null
        },
        {
          "unit_kind": "symbol",
          "span_start": 53,
          "span_end": 67,
          "local_name": "I",
          "kind": "interface",
          "anchor": "p:interface:I",
          "parent": null
        },
        {
          "unit_kind": "symbol",
          "span_start": 68,
          "span_end": 80,
          "local_name": "E",
          "kind": "enum",
          "anchor": "p:enum:E",
          "parent": null
        },
        {
          "unit_kind": "symbol",
          "span_start": 81,
          "span_end": 97,
          "local_name": "T",
          "kind": "type_alias",
          "anchor": "p:type_alias:T",
          "parent": null
        },
        {
          "unit_kind": "symbol",
          "span_start": 98,
          "span_end": 112,
          "local_name": "N",
          "kind": "namespace",
          "anchor": "p:namespace:N",
          "parent": null
        },
        {
          "unit_kind": "symbol",
          "span_start": 126,
          "span_end": 146,
          "local_name": "g",
          "kind": "const",
          "anchor": "p:const:g",
          "parent": null
        }
      ],
      "expected_unresolved": []
    },
    {
      "id": "parser.ts.nesting",
      "title": "Method and nested function parents",
      "status": "active",
      "provenance": {
        "source": "T04-03 (authored)"
      },
      "language": "typescript",
      "category": "syntax",
      "source": "class Host {\n  method(x: number) {}\n}\nfunction outer() {\n  function inner() {}\n}\n",
      "expected_units": [
        {
          "unit_kind": "file",
          "span_start": 0,
          "span_end": 81,
          "local_name": null,
          "kind": null,
          "anchor": "p:file",
          "parent": null
        },
        {
          "unit_kind": "symbol",
          "span_start": 0,
          "span_end": 37,
          "local_name": "Host",
          "kind": "class",
          "anchor": "p:class:Host",
          "parent": null
        },
        {
          "unit_kind": "symbol",
          "span_start": 15,
          "span_end": 35,
          "local_name": "method",
          "kind": "method",
          "anchor": "p:class:Host/method:method",
          "parent": 1
        },
        {
          "unit_kind": "symbol",
          "span_start": 38,
          "span_end": 80,
          "local_name": "outer",
          "kind": "function",
          "anchor": "p:function:outer",
          "parent": null
        },
        {
          "unit_kind": "symbol",
          "span_start": 59,
          "span_end": 78,
          "local_name": "inner",
          "kind": "function",
          "anchor": "p:function:outer/function:inner",
          "parent": 3
        }
      ],
      "expected_unresolved": []
    },
    {
      "id": "parser.ts.overloads",
      "title": "Overload signatures share a route but differ by signature",
      "status": "active",
      "provenance": {
        "source": "T04-03 (authored)"
      },
      "language": "typescript",
      "category": "syntax",
      "source": "function ov(a: number): number;\nfunction ov(a: string): string;\nfunction ov(a: any): any { return a; }\n",
      "expected_units": [
        {
          "unit_kind": "file",
          "span_start": 0,
          "span_end": 103,
          "local_name": null,
          "kind": null,
          "anchor": "p:file",
          "parent": null
        },
        {
          "unit_kind": "symbol",
          "span_start": 0,
          "span_end": 31,
          "local_name": "ov",
          "kind": "function",
          "anchor": "p:function:ov",
          "parent": null
        },
        {
          "unit_kind": "symbol",
          "span_start": 32,
          "span_end": 63,
          "local_name": "ov",
          "kind": "function",
          "anchor": "p:function:ov",
          "parent": null
        },
        {
          "unit_kind": "symbol",
          "span_start": 64,
          "span_end": 102,
          "local_name": "ov",
          "kind": "function",
          "anchor": "p:function:ov",
          "parent": null
        }
      ],
      "expected_unresolved": []
    },
    {
      "id": "parser.ts.anonymous",
      "title": "Anonymous / computed names fall back to ordinal anchors",
      "status": "active",
      "provenance": {
        "source": "T04-03 (authored)"
      },
      "language": "typescript",
      "category": "syntax",
      "source": "class Foo {\n  bar() {}\n  [Symbol.iterator]() {}\n}\n",
      "expected_units": [
        {
          "unit_kind": "file",
          "span_start": 0,
          "span_end": 50,
          "local_name": null,
          "kind": null,
          "anchor": "p:file",
          "parent": null
        },
        {
          "unit_kind": "symbol",
          "span_start": 0,
          "span_end": 49,
          "local_name": "Foo",
          "kind": "class",
          "anchor": "p:class:Foo",
          "parent": null
        },
        {
          "unit_kind": "symbol",
          "span_start": 14,
          "span_end": 22,
          "local_name": "bar",
          "kind": "method",
          "anchor": "p:class:Foo/method:bar",
          "parent": 1
        },
        {
          "unit_kind": "symbol",
          "span_start": 25,
          "span_end": 47,
          "local_name": null,
          "kind": "method",
          "anchor": "o:1",
          "parent": 1
        }
      ],
      "expected_unresolved": []
    },
    {
      "id": "parser.ts.imports",
      "title": "Module specifiers become classified unresolved references",
      "status": "active",
      "provenance": {
        "source": "T04-03 (authored)"
      },
      "language": "typescript",
      "category": "syntax",
      "source": "import { A } from \"./mod\";\nimport type { T } from \"./types\";\nexport * from \"./re\";\n",
      "expected_units": [
        {
          "unit_kind": "file",
          "span_start": 0,
          "span_end": 83,
          "local_name": null,
          "kind": null,
          "anchor": "p:file",
          "parent": null
        }
      ],
      "expected_unresolved": [
        {
          "source_unit": 0,
          "reference_text": "./mod",
          "reference_kind": "import"
        },
        {
          "source_unit": 0,
          "reference_text": "./types",
          "reference_kind": "type_import"
        },
        {
          "source_unit": 0,
          "reference_text": "./re",
          "reference_kind": "reexport"
        }
      ]
    },
    {
      "id": "parser.ts.empty",
      "title": "An empty file is a single empty file unit",
      "status": "active",
      "provenance": {
        "source": "T04-03 (authored)"
      },
      "language": "typescript",
      "category": "empty",
      "source": "",
      "expected_units": [
        {
          "unit_kind": "file",
          "span_start": 0,
          "span_end": 0,
          "local_name": null,
          "kind": null,
          "anchor": "p:file",
          "parent": null
        }
      ],
      "expected_unresolved": []
    },
    {
      "id": "parser.ts.whitespace",
      "title": "A whitespace-only file is a single file unit",
      "status": "active",
      "provenance": {
        "source": "T04-03 (authored)"
      },
      "language": "typescript",
      "category": "empty",
      "source": "   \n\n",
      "expected_units": [
        {
          "unit_kind": "file",
          "span_start": 0,
          "span_end": 5,
          "local_name": null,
          "kind": null,
          "anchor": "p:file",
          "parent": null
        }
      ],
      "expected_unresolved": []
    },
    {
      "id": "parser.ts.error",
      "title": "Malformed input recovers symbols and yields a fallback chunk",
      "status": "active",
      "provenance": {
        "source": "T04-03 (authored)"
      },
      "language": "typescript",
      "category": "error",
      "source": "function ok() {}\nfunction @@@ broken(\n",
      "expected_units": [
        {
          "unit_kind": "file",
          "span_start": 0,
          "span_end": 38,
          "local_name": null,
          "kind": null,
          "anchor": "p:file",
          "parent": null
        },
        {
          "unit_kind": "symbol",
          "span_start": 0,